[
  {
    "id": "coal_bearing_sandstone",
    "name_key": "formation.coal_bearing_sandstone.name",
    "description_key": "formation.coal_bearing_sandstone.description",
    "matrix_resource": "sandstone",
    "embedded_resources": [
      {
        "resource": "coal",
        "probability": 1.0,
        "min_grade": 0.02,
        "max_grade": 0.1
      }
    ]
  }
]
